,sentences
163,"A mid-level ridge to its east directed the newly formed system northwest to north initially, but as this ridge gradually dissipated, nearby Hurricane Odile became the dominant steering mechanism and forced the depression generally east."
164,"In close proximity to Odile, the depression was heavily sheared and thus failed to intensify into a tropical storm."
165,It instead degenerated to a remnant low around 06:00 UTC on September 15 before weakening to an open trough the next morning.
166,"--Hurricane Polo--
The interaction of a westward-tracking tropical wave that emerged off the coast of Africa on September 4, an eastward-tracking kelvin wave, and an elongated surface trough led to the formation of Tropical Storm Polo by 00:00 UTC on September 16 about 310 mi(500 km) south of Puerto Escondido, Mexico."
167,"Tracking northwest within an environment conducive for strengthening, Polo intensified into a Category 1 hurricane and reached peak winds of 75 mph(120 km/h) by 00:00 UTC on September 18 as an eye became evident on satellite imagery."
168,"A sharp increase in wind shear quickly thereafter caused the storm's center to become exposed, and a reconnaissance mission indicated that Polo weakened to a tropical storm by 18:00 UTC that day."
169,"After maintaining intensity for about a day, the cyclone weakened to a tropical depression by 06:00 UTC on September 22 and further decreased into a remnant low six hours later."
170,The low turned southwestward before dissipating well southwest of the southern tip of Baja California on September 26.
171,"At 15:00 UTC on September 16, a tropical storm watch was issued for the coast of Southwestern Mexico from Zihuatanejo, Guerrero to Cabo Corrientes, Jalisco."
172,"Just 24 hours later, a tropical storm warning was put in effect Punta San Telmo, Michoacán to Playa Perula, Jalisco."
173,"One tourist perished and three others, including two fisherman, went missing in Guerrero."
174,A total of 190 restaurants and 20 shops were damaged.
175,Damage in the state totalled at about 100 million pesos(US$7.6 million).
176,"--Hurricane Rachel--
A vigorous tropical wave moved off Africa on September 7, aiding in the formation of Hurricane Edouard before entering the East Pacific on September 19."
177,"There, it interacted with pre-existing southwesterly flow, eventually leading to the formation of a tropical depression around 18:00 UTC on September 23."
178,Moderate northeast wind shear prevented the west-northwest-moving depression from becoming Tropical Storm Rachel until 00:00 UTC on September 25.
179,"The next day, Rachel's original center dissipated and a new one formed under deep convection."
180,"Environmental conditions became more favorable on September 27, when the cyclone reached hurricane strength at 18:00 UTC."
181,"It attained peak winds of 85 mph(135 km/h) six hours later before dry air, wind shear, and cooler waters caused a quick decay as the storm moved north."
182,Rachel fell below hurricane strength around 06:00 UTC on September 29 and degenerated to a remnant low by 12:00 UTC the next morning.
183,It dissipated early on October 3.
184,"--Hurricane Simon--
A tropical wave departed Africa on September 14 and continued into the eastern Pacific ten days later, where it interacted with the ITCZ and produced a large area of convection."
185,"An area of low pressure developed within this convection and organized while moving west-northwest, becoming a tropical depression by 18:00 UTC on October 1 and intensifying into Tropical Storm Simon twelve hours later."
186,"Simon only slowly strengthened initially, limited by its broad size."
187,"However, beginning around 18:00 UTC on October 3, it began a 30-hour period of rapid intensification wherein maximum winds increased from 65 mph(105 km/h) to 130 mph(210 km/h), a Category 4 hurricane."
188,"The system turned northwest around the periphery of a ridge, tracking into a region of low ocean heat content that prompted cold water upwelling."
189,Simon rapidly weakened to a tropical storm early on October 6 before gradually degenerating to a remnant area of low pressure around 00:00 UTC on October 8.
190,The post-tropical cyclone turned east and moved ashore Baja California Sur several hours later before dissipating over rugged terrain by 06:00 UTC the next day.
191,"--Hurricane Ana--
An area of deep convection and a low-pressure area merged and became Tropical Depression Two-C on October 13."
192,"It slowly intensified and turned northwestward, developing into Tropical Storm Ana."
193,The storm continued intensifying and was upgraded to a strong tropical storm.
194,"Ana turned westward, strengthening into a Category 1 hurricane on October 17."
195,"As Ana kept south of the island chain, the hurricane produced large waves and winds."
196,"Consequently, the Central Pacific Hurricane Center initiated tropical storm watches."
197,Ana was downgraded to a tropical storm very early on October 20.
198,"Beginning on October 15, various tropical cyclone warnings and watches were issued for Hawaii, starting with a tropical storm watch for the Big Island."
199,"Three days later, a tropical storm warning was issued for Kauai and Nihau, and was extended to include portions of the Papahānaumokuākea Marine National Monument."
200,The threat of the storm forced parks and beaches to close in the state.
201,"While passing south of Hawaii, Ana produced heavy rainfall on most of the islands, peaking at 11.67 in(296 mm) at Keaumo on the Big Island."
202,"The rains caused the Sand Island water treatment plant in Honolulu to overflow, which sent about 5,000 gallons of partially treated wastewater into Honolulu Harbor."
203,"On October 25, Ana was downgraded to a tropical storm for the second time."
204,Ana continued on a track to the northwest and weakened even further.
205,The system eventually turned north and once again re-strengthened into a high-end tropical storm.
206,"Ana turned northwest and soon northeast, fluctuating in strength before being picked up by the jet stream."
207,"While racing off to the northeast at nearly 35 knots, Ana once again strengthened into a Category 1."
208,"After yet again being downgraded to a tropical storm, Ana became extratropical far to the northeast of Hawaii on October 26."
209,"--Tropical Storm Trudy--
A broad area of low pressure became established across the East Pacific during the first week of October."
210,"In conjunction with an eastward-moving convectively-coupled kelvin wave and a Tehuantepecer, a significant increase in convection in association with the low was observed."
211,"Following several days of consolidation, the disturbance acquired sufficient organization to be declared a tropical depression at 12:00 UTC on October 17; six hours later, it was upgraded to Tropical Storm Trudy."
212,"Amid an exceptionally favorable environment, Trudy quickly intensified as it moved north-northwestward, with the formation of an inner core and eye evident on conventional and microwave satellite imagery."
213,"At 09:15 UTC on October 18, the cyclone reached peak winds of 65 mph(105 km/h) as it moved ashore just southeast of Marquelia, Mexico."
214,"Trudy quickly weakened following landfall, weakening to a tropical depression at 18:00 UTC and dissipating by 06:00 UTC on October 19, while located over the mountains of southern Mexico."
215,"Trudy's remnant energy continued across Mexico and contributed to the development of Tropical Storm Hanna/Tropical Depression Nine on October 21, 2014."
216,"In preparation for the cyclone, various tropical cyclone watches and warnings were issued for the coastline of southeastern Mexico."
217,"A ""yellow"" alert was initially activated for Guerrero; however, following Trudy's period of rapid intensification, this was abruptly upgraded to a ""red"" alert for southeastern portions of the state as well as southwestern Oaxaca, and the remainder of the two states were placed under an ""orange"" alert."
218,"Upon making landfall, torrential rainfall associated with the cyclone caused numerous landslides and flooding."
219,"Approximately 4,075 people were evacuated from the most-at-risk locations."
220,"A total of 5,000 homes were affected by the storm, 218 of which damaged and an additional six completely destroyed."
221,"At the height of the storm, more than 20,000 households were without electricity."
222,A state of emergency was declared for 35 municipalities across Guerrero and 100 municipalities in Oaxaca.
223,"Overall, Trudy was responsible for nine deaths: eight in Guerrero and one in Campeche."
224,"--Hurricane Vance--
A trough that extended from the Atlantic's Tropical Storm Hanna into the eastern Pacific led to widespread convection south of the Gulf of Tehuantepec in late October."
225,"This disturbance remained disorganized until 06:00 UTC on October 30, when a well-defined center and organized thunderstorm activity led to the formation of a tropical depression."
226,The cyclone intensified into Tropical Storm Vance twelve hours later but ultimately weakened some due to the entrainment of dry air.
227,"After drifting for a day, mid-level ridging over the far eastern Pacific caused the storm to move west-northwest."
228,Improving environmental conditions allowed it to become a hurricane around 12:00 UTC on November 2 and rapidly strengthen to a Category 2 with winds of 110 mph(175 km/h) the next day.
229,"Vance curved northeast into a higher shear environment by November 4, causing the system to weaken from a Category 2 hurricane to a tropical depression in an 18-hour period."
230,The depression opened up into a trough around 12:00 UTC on November 5 and moved ashore Sinaloa and Nayarit several hours later before dissipating.
231,"Heavy rains from the remnants of Vance, lasting 40 hours in some places, damaged 2,490 homes across 7 municipalities in the Mexican state of Durango."
232,Flooding up to 1 m(3.3 ft) in depth affected ten homes in San Dimas.
233,Thirty families in the area were evacuated due to the rising water.
234,"A few landslides were reported in the region, though no major damage resulted."
235,"-Storm names-
The following list of names was used for named storms that formed in the North Pacific Ocean east of 140°W during 2014."
236,"This is the same list used in the 2008 season, with the exception of Amanda, which replaced Alma."
237,The name Amanda was used for the first time this year.
238,"For storms that form in the North Pacific from 140°W to the International Date Line, the names come from a series of four rotating lists."
239,"Names are used one after the other without regard to year, and when the bottom of one list is reached, the next named storm receives the name at the top of the next list."
240,"Two named storms, listed below, formed within the area in 2014."
241,"Also, named storms in the table above that crossed into the area during the season are noted(*)."
242,"--Retirement--
On April 17, 2015, at the 37th session of the RA IV hurricane committee of the World Meteorological Organization(WMO) retired the name Odile from its rotating name lists due to the damage and loss of life it caused, and it will not be used again in the Eastern Pacific basin."
243,Odile was replaced with Odalys for the 2020 season.
244,"The WMO also removed the name Isis from its place in the rotation, deeming its continued use as a storm name inappropriate because it had become associated with the Islamic extremist militant group known widely as ISIS."
245,The name Ivette was chosen to replace it in the 2016 season.
246,"-Season effects-
This is a table of all of the tropical cyclones that formed in the 2014 Pacific hurricane season."
247,"It includes their name, duration(within the basin), peak classification and intensities, areas affected, damage, and death totals."
248,"Deaths in parentheses are additional and indirect(an example of an indirect death would be a traffic accident), but were still related to that storm."
249,"Damage and deaths include totals while the storm was extratropical, a wave, or a low, and all of the damage figures are in 2014 USD."
250,-Footnotes-
