index,sentences
163,"On August 14, Reynolds arrived in Cedar Rapids, Iowa with more than 100 Iowa National Guard members, activated to help repair the damage."
164,"On August 15, Finkenauer toured damage in Marshalltown."
165,"On August 17, Pete Gaynor, Administrator of FEMA, traveled to Iowa to meet with Governor Reynolds about the disaster."
166,"On August 18, Trump arrived at midday in Cedar Rapids, joining a private meeting with Iowa senators Grassley, Ernst and Cedar Rapids Mayor Brad Hart."
167,"At the meeting, Hart begged Trump to approve the Individual Assistance Program."
168,"Trump remained at the airport and did not interact with the public, tour damage, or assist in recovery efforts during his visit."
169,"On August 19, Naig met with farmers in Marion to personally assess the damage."
170,Ernst toured damaged in Marshalltown.
171,"On September 2, Grassley and Ernst fielded questions from Cedar Rapids-area non-profit organizations."
172,"On September 3, US Secretary of Agriculture Sonny Perdue underwent an Iowa National Guard-hosted aerial tour of crop damage in Iowa along with Reynolds, Ernst, and Naig."
173,"--Local, non-government, or individual assistance efforts--
On August 14, the city of Cedar Rapids set up five resource centers to distribute basic necessities to the public."
174,These centers were later shut down on August 31.
175,"Many local businesses, private individuals, religious groups, and non-profit organizations, such as Cedar Valley Black Lives Matter, The Salvation Army and Tyson Foods, and United Way, raised money online or provided relief efforts on their own, distributing food, fuel, toiletries, or assisting in debris removal."
176,"Mid-American Energy, one of Iowa's two major electric utilities, gave away bagged ice in Cedar Rapids on August 20–21."
177,"Operation BBQ Relief, a disaster relief agency specializing in barbecue, deployed to Cedar Rapids starting August 16, providing over 45,000 meals to residents as of August 21, earning praise from politicians."
178,Local non-profits told Iowa's senators that assisting the region has been difficult due to the COVID-19 pandemic significantly reducing their donations and funding.
179,"On November 14, a large replanting campaign was announced that would begin in the spring of 2021."
180,"--Criticism--
---Lack of news coverage---
Local news media were hard-pressed to provide reporting under disaster conditions, limiting national news coverage of the storm."
181,KCRG-TV anchor Beth Malicki was especially prominent in speaking out on awareness of the situation.
182,"On August 13, Cedar Rapids Mayor Hart gave an interview where he rejected requesting National Guard assistance, uncertain of what it could do."
183,"---Lack of response and assistance---
On August 14, Ashton Kutcher, originally from Cedar Rapids, criticized the lack of federal response and aid."
184,He called on Pence and Trump to aid the affected areas.
185,"The same day, Iowa state officials were questioned about why it took three days to begin aid effort."
186,"General Benjamin Corell, commander of the Iowa National Guard, said they first received local requests for help on August 13."
187,Residents of Cedar Rapids had mixed emotions regarding official responses and assistance.
188,"For many, they felt ignored for days after the storm and offered too-little, too-late by the non-local support."
189,"Some impoverished or less-affluent neighborhood residents said they felt neglected, abandoned, or given lower priority among utility and government assistance."
190,"Many grassroots efforts began hours after the storm subsided, with residents lending support through mutual aid, and trying to take care of the least fortunate, but finding working with government and assistance organizations very disheartening."
191,"The lack of electricity, telecommunications, and ability to travel led to the delays in assistance according to both official and non-government organizations."
192,These explanations did not reassure storm-battered populations.
193,"Tamara Marcus, activist with Cedar Rapids Advocates for Social Justice, a Black Lives Matter organization, said ""We need to ask ourselves, 'Why is it that each time we have a disaster or pandemic, the most-vulnerable are the worst impacted, particularly communities of color?'"
194,""" during a September 2 forum with Ernst and Grassley."
195,Residential damage doubled the homeless population in the Cedar Rapids area as some landlords evicted residents from unsafe apartment complexes.
196,"---Role of politicians---
Abby Finkenauer, then-US Representative for Iowa's 1st congressional district(which encompassed Cedar Rapids and other hard-hit areas), used her local office for an assistance event, personally handing out essentials such as food, water, and toiletries until supplies ran out."
197,"Finkenauer's challenger in the 2020 United States House of Representatives elections, then-Iowa State Representative Ashley Hinson criticized her opponent for showing images of these events in a campaign ad, with the Republican Party of Iowa calling it ""disgraceful""."
198,"The Democratic Congressional Campaign Committee returned the criticism, saying that while Hinson had released a stereotypical ad and posed for storm-related photo ops, Finkenauer actually worked on doing something meaningful at the time."
199,Hinson has since collaborated with local religious and charitable groups.
200,"Ernst and her Democratic challenger in that year's election, Theresa Greenfield, both provided assistance."
201,"Greenfield handed out supplies, served food, and toured damage."
202,Ernst helped distribute food with local charities including Meals on Wheels.
203,Neither politician saw the disaster assistance as optional.
204,Reynolds and Hinson both visited the August 21 Operation BBQ Relief event.
205,Political science professors in the state commented.
206,"Tim Hagle from the University of Iowa said the key is ""to strike the balance between political grandstanding — or opportunism — and a genuine desire to help, which also helps you politically""."
207,"Chris Larimer of the University of Northern Iowa concurred, adding that practical help is more likely to earn voter support."
208,"At Cornell College, Megan Goldberg said ""an elected official wants to claim credit for disaster relief that is effective, while avoiding blame for any mismanagement of disaster relief"", concluding that ""even a candidate or official who genuinely wants to visit a site — either to help or to gather information — has to think about how the visit can be spun to his or her political advantage, and how to reply to criticisms of such visits."
209,"But that's the way it often is these days."""
210,"-Possible impact of climate change-
The severity of the storm raised the question of whether climate change intensified it."
211,"A variety of climate experts from Georgia Tech, Colorado University, North Carolina State, and other institutions told the Associated Press, in the wake of the derecho, 2020 wildfire season, and 2020 Atlantic hurricane season, that more intense natural disasters like these are consistent with climate change."
212,"Climate change is a possible cause of the intensity of derechos overall, said Iowa State University and National Weather Service(Des Moines) scientists;  experts disagreed if it was responsible for this particular storm."
213,The NWS said it was atypical for such a severe storm to not appear in the previous day's weather models.
214,"Additionally, NWS research into derechos indicates weather patterns in the region to be shifting towards the poles, which might be a result of climate change."
215,The high damage estimate aligns with analysis showing increases in the costs of natural disasters as a result of climate change-driven storm intensity.
216,"-Official notices and records-
The Storm Prediction Center(SPC) did not initially foresee an event of this magnitude, primarily due to sporadic model solutions, more specifically the large variance in intensity, location, and coverage of this derecho."
217,"During the 06:00 UTC(1AM CDT) convective outlook update, a slight, or level 2/5 risk for severe thunderstorms was introduced in an area spanning approximately from Kansas to central Illinois due to other severe weather potential, with lower threats in the area eventually hit by the derecho."
218,"As model guidance became clearer during the overnight hours, parts of Iowa and Illinois were put under an enhanced(level 3/5) risk at 13:00 UTC(8AM CDT) before the region was further upgraded to a moderate risk(level 4/5) at 16:30 UTC(11:30AM CDT) once the derecho was clearly underway and expected to continue."
219,"--Official NWS Storm Prediction Center publications--
---Severe Weather Watch Bulletins---
---Mesoscale Discussions---
--Highest recorded winds--
-Confirmed tornadoes-
-Notes-"
