index,sentences
211,"---Elsewhere in the United States---
While approaching Delaware, Agnes produced tides about 1.5 feet(0.46 m) above normal at the Indian River Inlet."
212,"High winds were also reported in the state, and at the Dover Air Force Base, a wind gust as high as 67 mph(108 km/h) was reported."
213,"Rainfall was generally light, peaking at 7.6 inches(190 mm) in Middletown."
214,"Street flooding was reported and basements in low-lying area were flooded, though damage in Delaware was minimal."
215,One fatality occurred in that state.
216,"In the Washington, D.C. area, moderate rainfall was reported, with precipitation amounts peaking at 13.65 inches(347 mm) at the Washington Dulles International Airport."
217,Significant flooding occurred and it was described as the worst in at least 44 years.
218,"In the Georgetown section, waterfront streets along the Potomac River were submerged in as much as 7 feet(2.1 m) of water."
219,"The Rock Creek also overflowed its banks, which sent about 10 feet(3.0 m) of water onto the Rock Creek Parkway."
220,"As a result, at least 100 cars were abandoned and several motorists required rescuing by police."
221,No national monuments were affected by flood waters.
222,"However, about 350 dwellings in Washington, D.C. suffered minor damage."
223,"At the White House, reporters noted wet carpets in the press room of the basement floor."
224,"In Connecticut, winds were well below tropical storm force, although a wind gust of 46 mph(74 km/h) was reported in Hartford."
225,"Rainfall in the state was modestly heavy, with 3.00 inches(76 mm) three day total at Bridgport."
226,"Along the coast of Connecticut, high tides and heavy rainfall flooded coastal roads and basements."
227,"High tides occurred along the coastline of Rhode Island, reaching 3.2 feet(0.98 m) above normal in Providence."
228,"In combination with rainfall and high tides, some coastal roads were flooded."
229,"Strong winds felled trees and numerous limbs in Massachusetts, causing power outages and property damage in the western and central portions of the state."
230,One home in Great Barrington was struck by a tree; a similar incident occurred in Milford.
231,"High winds in southern and eastern Vermont knocked over trees and snapped off limbs, which resulted in scattered power outages, roads being blocked, and minor property damage."
232,"In Mendon, a tree fell on a house, while two cars were damaged after being struck by limbs."
233,"Similar conditions occurred in New Hampshire, albeit effects were lesser."
234,"--Elsewhere--
As a precaution, more than 8,000 people in western Cuba, including on Isla de la Juventud(Isle of Pines), were evacuated."
235,"In western Cuba, Agnes dropped heavy rainfall, peaking at 16.76 inches(426 mm) on Isla de la Juventud."
236,"At Cape San Antonio, the westernmost point in Cuba, precipitation reached 15.32 inches(389 mm)."
237,"Due to high winds and flooding, at least 97 houses were destroyed and another 270 were damaged."
238,"In the Pinar del Río Province, the cities of Guane and Mantua were isolated by swollen rivers."
239,It was also reported that extensive crop damage occurred in low-lying areas.
240,"Overall, seven fatalities occurred in Cuba, though the damage toll is unknown."
241,"However, some sources claim Agnes caused 16 fatalities and reported 24 people injured."
242,"In Canada, Hurricane Agnes gave heavy rains and winds over southern Ontario and southern Quebec, causing numerous floodings around Lake Erie and Lake Ontario."
243,"In the town of Maniwaki, Quebec, the storm toppled a mobile home, killing two people."
244,"-Aftermath-
Following the storm, President Richard Nixon declared 14 counties in Florida as a disaster area, including: Brevard County, Dixie County, Franklin County, Hendry County, Hillsborough County, Lee County, Levy County, Manatee County, Monroe County, Okeechobee County, Pasco County, Pinellas County, Sarasota County, and Wakulla County."
245,"In Panama City, Florida, where over 25,000 tourists evacuated, effects were not significant."
246,"As a result, the city lost millions of dollars from tourism, which led the officials of Panama City to file a $100 million lawsuit against the National Weather Service."
247,"Officials in that city believed that the National Weather Service and other media outlets made ""exaggerated and erroneous"" forecasts and reports on the storm."
248,"Nixon also declared the states of Florida, Virginia, Maryland, Pennsylvania, and New York as disaster areas."
249,Twenty of Maryland's 24 counties were declared a disaster area.
250,"Agnes had a devastating impact on the already-bankrupt railroads in the northeastern United States, as lines were washed out and shipments were delayed: 
The Erie Lackawanna Railway(EL) estimated that damage between Binghamton and Salamanca, New York, amounted to $2 million."
251,EL filed for Chapter 7 bankruptcy.
252,"The Penn Central Railroad sustained nearly $20 million in damages
The resulting cost of repairing the damage was one of the factors leading to the creation of the federally financed Conrail."
253,"Some Americans sardonically referred to the storm as ""Hurricane Agony""."
254,"The severe floods near Lawrenceville, Pennsylvania, were the catalyst for the construction of the Tioga Reservoir in 1973."
255,"The flooding in Wilkes-Barre, Pennsylvania, and the adjacent town of Kingston led to the construction of a levee system that in 2006 successfully prevented massive flooding and, in the same year, was deemed very safe and protective by the Army Corps of Engineers."
256,"The levee also protected the area from the remnants of Tropical Storm Lee and Hurricane Irene in 2011, with the water cresting just barely below the height of the structure."
257,"Conversely, the existing Kinzua Dam, built against the wishes of the Seneca Nation of New York, spared much of Western Pennsylvania from the worst flooding, by filling the Allegheny Reservoir to capacity."
258,"Footage is included in the 1987 film Disasters-Anatomy of Destruction, hosted by George Kennedy."
259,"--Retirement--
On account of the extensive damage and high death toll, the name Agnes was retired after the 1972 season."
260,The name will never again be used for an Atlantic basin tropical cyclone.
