index,sentences
0,"Hurricane Agnes was the costliest hurricane to hit the United States at the time, causing an estimated $2.1 billion in damage."
1,The hurricane's death toll was 128.
2,"The effects of Agnes were widespread, from the Caribbean to Canada, with much of the east coast of the United States affected."
3,"Damage was heaviest in Pennsylvania, where Agnes was the state's wettest tropical cyclone."
4,"Due to the significant effects, the name Agnes was retired in the spring of 1973."
5,Agnes was the second tropical cyclone and first named storm of the 1972 Atlantic hurricane season.
6,It developed as a tropical depression on June 14 from the interaction of a polar front and an upper trough over the Yucatán Peninsula.
7,"The storm emerged into the western Caribbean Sea on June 15, and strengthened into Tropical Storm Agnes the next day."
8,"Thereafter, Agnes slowly curved northward and passed just west of Cuba on June 17."
9,"Early on June 18, the storm intensified enough to be upgraded to Hurricane Agnes."
10,"Heading northward, the hurricane eventually made landfall near Panama City, Florida, late on June 19."
11,"After moving inland, Agnes rapidly weakened and was only a tropical depression when it entered Georgia."
12,The weakening trend halted as the storm crossed over Georgia and into South Carolina.
13,"While over eastern North Carolina, Agnes re-strengthened into a tropical storm on June 21, as a result of baroclinic activity."
14,"Early the following day, the storm emerged into the Atlantic Ocean before re-curving northwestward and making landfall near New York City as a strong tropical storm."
15,"Agnes quickly became an extratropical cyclone on June 23, and tracked to the northwest of Great Britain, before being absorbed by another extratropical cyclone on July 6."
16,"Though it moved slowly across the Yucatán Peninsula, the damage Agnes caused in Mexico is unknown."
17,"Although the storm bypassed the tip of Cuba, heavy rainfall occurred, killing seven people."
18,"In Florida, Agnes caused a significant tornado outbreak, with at least 26 confirmed twisters, two of which were spawned in Georgia."
19,The tornadoes and two initially unconfirmed tornadoes in Florida alone resulted in over $4.5 million(1972 USD) in damage and six fatalities.
20,"At least 2,082 structures in Florida suffered either major damage or were destroyed."
21,"About 1,355 other dwellings experienced minor losses."
22,"Though Agnes made landfall as a hurricane, no hurricane-force winds were reported."
23,"Along the coast abnormally high tides resulted in extensive damage, especially between Apalachicola and Cedar Key."
24,"Light to moderate rainfall was reported in Florida, though no significant flooding occurred."
25,"In Georgia, damage was limited to two tornadoes, which caused approximately $275,000 in losses."
26,"Minimal effects were also recorded in Alabama, Connecticut, Delaware, Rhode Island, South Carolina, and Tennessee; though one fatality was reported in Delaware."
27,"The most significant effects, by far, occurred in Pennsylvania, mostly due to intense flooding."
28,"The tropical storm severely flooded the Susquehanna River and the Lackawanna River, causing major damage to the Wilkes-Barre/Scranton metropolitan area."
29,"In both Pennsylvania and New Jersey combined, about 43,594 structures were either destroyed or significantly damaged."
30,"In Canada, a mobile home was toppled, killing two people."
31,"-Meteorological history-
In early-mid June 1972, atmospheric conditions favored tropical cyclogenesis in the Caribbean Sea."
32,"Banded convection developed in the northwestern Caribbean Sea by June 11, though the system did not significantly organize."
33,"After an upper trough moved east, wind shear decreased, causing lower atmospheric pressures observations in Cozumel, Quintana Roo, Mexico."
34,"It is estimated that a tropical depression developed by 1200 UTC on June 14, while centered over the Yucatán Peninsula, about 78 miles(126 km) southeast of Mérida, Yucatán."
35,The depression tracked eastward and entered the western Caribbean Sea on June 15.
36,"Operationally, the National Hurricane Center did not initiate advisories on the depression until 1500 UTC on June 15."
37,"Early on June 16 at 0000 UTC, the depression strengthened into Tropical Storm Agnes."
38,"However, the depression was not operationally upgraded until sixteen hours later."
39,"After becoming a tropical storm on June 16, Agnes slowly curved northward and approached the Yucatán Channel."
40,"Late on June 17, it was noted that projected path indicated the possibly of landfall in western Cuba."
41,"However, the storm remained offshore, though it closely brushed the western tip of Cuba."
42,"At 1200 UTC on June 18, Agnes intensified into a hurricane while in the southeastern Gulf of Mexico."
43,"Prematurely, the National Hurricane Center operationally upgraded Agnes to a hurricane at 0200 UTC on that day."
44,"Upon becoming a hurricane, Agnes attained its maximum sustained winds of 85 mph(140 km/h), though it had not reached its minimum atmospheric pressure."
45,"Due to unfavorable conditions, Agnes leveled-off slightly in intensity and weakened to a minimal hurricane while approaching the Gulf Coast of the United States."
46,"Shortly before 2200 UTC on June 19, Agnes made landfall near Cape San Blas, Florida with winds of 75 mph(120 km/h)."
47,"At 0000 UTC on June 20, only a few hours after moving inland, Agnes weakened to a tropical storm."
48,"After crossing the Florida/Alabama/Georgia stateline, Agnes rapidly weakened to a tropical depression."
49,"While over Georgia, the depression curved northeastward and eventually to the east-northeast after entering South Carolina."
50,"Though the storm had not dissipated, the National Hurricane Center issued its final bulletin on Agnes at 1600 UTC on June 20."
51,"By early on June 21, a large extratropical trough spawned a low pressure area, which resulted in baroclinic activity."
52,"As a result, Agnes restrengthened into a tropical storm at 1800 UTC on June 21, while centered over eastern North Carolina."
53,"Three hours later, the National Hurricane Center noted decreasing atmospheric pressures, and indicated that winds had reached gale-force winds and once again upgraded Agnes to a tropical storm."
54,"By early on June 22, Agnes emerged into the northwestern Atlantic Ocean, where it continued to re-intensify."
55,"At 1200 UTC, Agnes reached its minimum atmospheric pressure of 977 mbar(28.9 inHg), as reported by a reconnaissance aircraft."
56,"However, maximum sustained winds were at only 70 mph(110 km/h)."
57,"Late on June 22, Agnes made its final landfall on Long Beach, New York, on Long Island,  with winds of 65 mph(100 km/h)."
58,"Agnes changed into an extratropical cyclone once cold air invaded its circulation late on June 22, completing its extratropical transition on the next day."
59,The system looped across south-central Pennsylvania on June 23 and then looped across southern Ontario on June 25.
60,"It spawned a tornado in Maniwaki, Québec, early that day, which killed two and injured 11 people."
61,"The cyclone sped east-northeast, reaching Cape Breton Island on June 27 before intensifying as it re-entered the North Atlantic."
62,"After moving as far north as the 61st parallel while crossing the 25th meridian west on the morning of June 29, Agnes turned southeastward."
63,Its central pressure bottomed out near 980 millibars(29 inHg) towards 0000 UTC on June 30.
64,"Between July 1 and July 3, the long-lived system looped between Ireland and Iceland while weakening once more."
65,"The system turned northeast, strengthening one more time while accelerating across the Hebrides on July 4 through 5."
66,"A stronger system moving in from the west finally absorbed Agnes on July 6, while located to the southeast of Iceland."
67,"-Preparations-
By 2200 UTC on June 17, the National Weather Service issued gale warnings and a hurricane watch for the Straits of Florida and the Florida Keys from Key West to Dry Tortugas."
68,"On the following day at 1600 UTC, another hurricane watch was put into effective from Cedar Key to Pensacola."
69,"In addition, the gale warnings in the Florida Keys were extended to include areas from Fort Myers Beach to Clearwater."
70,"At 2200 UTC on June 18, a hurricane warning became effective from St. Marks to Panama City."
71,The gale warnings which were in effect for the Florida Keys and Fort Myers Beach to Clearwater was discontinued at 1000 UTC on June 19.
72,It is likely that the hurricane warning was discontinued after the National Hurricane Center downgraded Agnes to a tropical storm at 2200 UTC on June 20.
73,"Two hours later, all gale warnings along the West Coast of Florida were discontinued."
74,"-Impact-
--United States--
In the United States, Agnes affected 15 states and the District of Columbia."
75,"Almost 110,000 houses were ruined by Agnes, 3,351 of which were destroyed."
76,"In addition, 5,211 mobile homes were either damaged or completely destroyed."
77,"Farm buildings and small businesses also suffered extensively, with 2,226 and 5,842 structures experiencing major losses or were destroyed."
78,"Of the 128 storm-related fatalities, 119 occurred in the United States."
79,"Agnes was, at the time, the costliest hurricane on record in U.S. history; losses far exceeded the combined losses from Hurricane Betsy(1965) and Hurricane Camille(1969)."
80,"---Florida---
Upon landfall, Agnes produced abnormally high tides along much of the Florida coastline."
81,"The highest tides reported were at Cedar Key, reaching 7 feet(2.1 m) above normal sea levels."
82,"The second largest waves were 6.4 feet(2.0 m), recorded at Apalachicola."
83,"In contrast, few observations of high tides along the east coast of Florida exist; the highest reported was 3 feet(0.91 m) above average in Jacksonville."
84,"In Alligator Point, at least 16 homes were swept off their foundations."
85,Six bridges connecting Cedar Key to the mainland areas of Florida were submerged.
86,"In addition, a bridge from Coquina Key to St. Petersburg was also underwater due to high tides."
87,Tampa Bay had an unusually high tide flooding the low lying Shore Acres neighborhood in St. Petersburg.
88,"Nearly the entire state of Florida reported rainfall, though it was usually in the light to moderate range."
89,"Among the highest amounts of precipitation recorded were 8.97 inches(228 mm) in Naples, 8.43 inches(214 mm) in Big Pine Key, 7.3 inches(190 mm) in the Everglades, and 7.17 inches(182 mm) in Tallahassee."
90,"Near Okeechobee, larger amounts of rainfall may have occurred, though there were no specific observations in that vicinity."
91,"Though Agnes made landfall as a hurricane, no reports of hurricane-force winds exist."
92,"However, several locations observed tropical storm force winds."
93,"The highest sustained winds and gusts were 52 and 69 mph(84 and 111 km/h), both recorded at the Kennedy Space Center."
94,"Other reports of at least tropical storm force sustained winds were at 39 mph(63 km/h) in Crestview and Jacksonville, 42 mph(68 km/h) in Flamingo, 43 mph(69 km/h) in Key West, and two observations of 40 mph(64 km/h) in Panama City."
95,"Throughout the state, Agnes spawned at least 15 tornadoes, while several tornadoes were operationally unconfirmed."
96,"Initially referred to as a ""windstorm"", one of those twisters destroyed 50 mobile homes and a fishing camp in Okeechobee, as well as caused six fatalities."
97,"Another significant tornado occurred in Cape Canaveral, which destroyed two homes and 30 trailers; it also damaged 20 houses and the Port Canaveral Coast Guard station."
98,"Overall, more than 100 people were left homeless and caused 23 injuries and over $500,000 in damage."
99,The costliest tornado was also spawned in Brevard County and it destroyed 44 planes at the Merritt Island Airport and an apartment building.
100,"In addition, several houses in a nearby subdivision were also damaged."
101,Losses from this tornado are estimated at $3 million.
102,"Due to a combination of high tides, rainfall, winds, and tornadoes, 96 dwellings were destroyed, while about 1,802 suffered damage to some degree."
103,The destruction of 177 mobile homes was reported and 374 others were significantly damaged.
104,"Furthermore, 988 small businesses in the state were either destroyed or had major damage."
105,"Eight counties in Florida reported at least $1 million in damage, including $12.1 million in Pinellas, $7.1 million in Sarasota, $4.1 million in Brevard, $3.1 million in Pasco, $2 million in Manatee, $1.4 million in Wakulla and Franklin, $1.3 million in Monroe, and $1 million in losses in Hillsborough Counties."
106,"Although the damage toll estimated by the National Hurricane Center was at $8.243 million, the National Climatic Data Center noted that at least $39 million in losses were reported."
107,"In addition, nine fatalities were reported in Florida."
108,"---Southeastern United States---
In the states immediately to the north of Florida, impact was relatively minor."
109,"Rainfall was generally light in Georgia, though peaking at 8.55 inches(217 mm) in Brunswick."
110,"Other locations that reported precipitations include 4.54 inches(115 mm) in Albany, 3.95 inches(100 mm) in Savannah, and 3.18 inches(81 mm) in Macon."
111,"During the tornado outbreak, two of the tornadoes were spawned in Georgia."
112,"The tornado in Pierce County caused $25,000 in damage and one injury."
113,"Losses were more significant from the twister in Coffee County, reaching $250,000."
114,"One mobile home in Georgia suffered significant damage, though it is unknown if this was related to the tornadoes."
115,"Though the damage from both tornadoes combined was about $275,000, the National Hurricane Center notes only $205,000 in losses."
116,"In Alabama, tides up to 1.3 feet(0.40 m) above normal were reported in the Mobile Bay area."
117,"Though rainfall only reached 3.93 inches(100 mm) and 1.08 inches(27 mm) in Dothan and Mobile, precipitation from the storm in the state of Alabama peaked at 7.67 inches(195 mm) in Headland."
118,"Damage in the state was minor, though low-lying streets in the Gulf Shores were flooded."
119,"In some areas of South Carolina, the storm dropped as much as 9.5 inches(240 mm) of rain in less than 36 hours."
120,"As a result, several rivers flooded."
121,"Along the Pee Dee River, pastures, small grains, and soy bean crops near Cheraw suffered major damage; similar effects occurred along the Congaree River near Columbia, though damage was lesser."
122,"In Greenville, damage to basements, streets, and water systems occurred after the Reedy River overflowed."
123,"Damage in South Carolina was minor, totaling to only $50,000."
124,"Effects were very minimal in Tennessee and limited to light rainfall in the eastern portions of the state, generally reaching no more than 3 inches(76 mm)."
125,The highest amount of precipitation recorded was 4.59 inches(117 mm) in Unicoi.
126,"---Virginia---
In Richmond, four people drowned after their car plunged into the swollen James River."
127,"A train bound for Washington D.C. stopped due to flooding in Richmond, which temporarily stranded 537 passengers."
128,"The Peak Creek in western Virginia overflowed its banks, flooding a low-income housing area of Pulaski with water up to rooftops."
129,"At the height of the flooding, over 600 miles(970 km) of highways were submerged, resulting in $14.8 million in damage to roads in the state."
130,"Severe damage also occurred to sewer and water facilities, totaling to $34.5 million."
131,"95 houses were destroyed and 4,393 others were damaged, while 125 mobile homes were destroyed and another 450 were significantly affected."
132,"Additionally, 205 small businesses were either damaged or destroyed."
133,The Interstate 95(I-95) Purple Heart Bridge over northern Virginia's Occoquan River was severely damaged and closed when rammed by a large barge carried by floodwaters.
134,"In the Washington DC suburbs, the Alexandria reservoir Lake Barcroft emptied when its dam was undermined and breached."
135,"Overall, flooding was described as ""the worst in 50 years""."
136,"In Virginia alone, 13 fatalities and $125.9 million in losses were reported."
137,"---Maryland---
In Baltimore, a woman's car was swept off a highway; firemen in rowboats were able to rescue her, but her three children drowned."
138,"In the state of Maryland, damage totaled to $110 million and 19 fatalities were reported."
139,"The hardest hit area was the Patapsco River valley, with widespread destruction of buildings, roads, and railroads in the state park, at Daniels including its mill, at Ellicott City, and Oella."
140,The flooding was first reported in the early morning hours of June 22 and water was reported as high as 40 feet(12 m) above normal.
141,River Road along the Patapsco was almost completely washed out.
142,More than 900 people were evacuated from their homes.
143,National guard helicopters were used to rescue workmen from the roof of the Daniels' plant.
144,"In Elkridge, a family of six was forced from their home and they attempted to reach high ground in a small boat."
145,It capsized and all six held onto the boat for several hours until it reached more shallow water.
146,"In Howard County, a total of 704 county residents were left homeless."
147,More than 80 homes in the Ellicott City area were damaged and 72 homes in Elkridge were affected.
148,"In Laurel, the 9th Street Bridge crossing the Patuxent River was washed away by flood waters."
149,"In Anne Arundel County, all roads linking the county with Baltimore city or county were closed(including the Baltimore Beltway) as were all roads ""near the Patuxent River"" including Waysons Corner where over 300 homes were evacuated."
150,"The Patapsco flooded residential homes in parts of the county's North Linthicum, Pumphrey, and Belle Grove Road, Brooklyn Park neighborhoods."
151,The Gwynn Oak Amusement Park closed after suffering severe damage from flooding when Hurricane Agnes caused Gwynns Falls to overflow.
152,"In 1974, the park's rides were auctioned off."
153,"The carousel was moved and is still in operation on the National Mall in Washington, D.C.
A popular footbridge in the Chesapeake and Ohio Canal National Historical Park which led across a branch of the Potomac River to an overlook of Great Falls was washed away and not rebuilt until 1996."
154,"As a result of Agnes' rains, Conowingo Dam, astride the Susquehanna River just north of the Chesapeake Bay, recorded its all-time highest flow rate and stream heights."
155,"Before the river crested, the water came within feet of overtopping the dam."
156,"As the dam's normal flood control devices seemed unable to cope, engineers had placed charges to blow out a section of the dam to prevent a catastrophic failure."
157,"The towns along the Susquehanna below the canal, Port Deposit, Perryville, and Havre de Grace, were flooded as  torrents of water rushed through streets."
158,"Late on June 23, a mandatory evacuation of Port Deposit's nearly 1,000 residents was ordered as the river continued to rise, causing the fire department to bring evacuees out by boat during an eight-hour period as over four-feet of water filled Main Street."
159,"---Pennsylvania---
In Pennsylvania, heavy rainfall was reported, with much of the state experiencing more than 7 inches(180 mm) of precipitation."
160,"Furthermore, a large swath of rainfall exceeding 10 inches(250 mm) was reported in the central part of the state."
161,"Overall, the rains peaked at 19 inches(480 mm) in the western portions of Schuylkill County."
162,"As a result, Agnes is listed as the wettest tropical cyclone on record for the state of Pennsylvania."
163,"Overall, more than 100,000 people were forced to leave their homes due to flooding."
164,The Allegheny River reached above flood stage at several low-lying locations and at some places rose about 7 in(180 mm) per hour during the height of the storm.
165,"Additionally, the Susquehanna River threatened to reach record crests along its course."
166,Some buildings were under 13 ft(4.0 m) of water in Harrisburg.
167,"At the Governor's Mansion, the first floor was submerged by flood waters."
168,Governor Milton Shapp and his wife Muriel had to be evacuated by boat due to flooding.
169,More than one hundred Harrisburg YMCA campers and staff were evacuated using two CH-47 Chinook helicopters flown by the National Guard at Camp Shikellimy located downstream of DeHart Dam in Middle Paxton Township.
170,Hundreds were trapped in their homes in Wilkes-Barre due to the overflowing Susquehanna River.
171,"At the historic cemetery in Forty Fort, 2,000 caskets were washed away, leaving body parts on porches, roofs, and in basements."
172,"In Luzerne County alone, 25,000 homes and businesses were either damaged or destroyed."
173,Losses in that county totaled to $1 billion.
174,"A bridge collapsed in Danville, which caused two Penn Central diesel locomotives and several freight cars to fall into a swollen creek."
175,"In Reading, the Schuylkill River reached a record flood of 31 feet 6 inches(9.60 m)."
176,Hundreds of people were evacuated and over a hundred homes destroyed.
177,Floods reached as far inland as 3rd street in the heart of the city.
178,"In Chadds Ford Township in Delaware County, the Brandywine Creek crested at 16.5 feet(5.0 m), sending flood waters into the city."
179,"Water poured into the first floor of the Brandywine River Museum of Art in Chadds Ford Township, which threatened at least $2.5 million in N.C. Wyeth paintings, though they were quickly moved to the upper floors."
180,"Additionally, 36 Girl Scouts were rescued by state police while at a camp in York."
181,"Throughout the state of Pennsylvania, Agnes demolished more than 3,000 businesses and 68,000 homes, while damaging numerous others."
182,"Consequently, at least 220,000 people were left homeless."
183,"The damage and death toll was the highest in Pennsylvania, with 50 fatalities and $2.3 billion in losses in that state alone,  including more than $1 billion in damage to businesses, $500 million to roadways, $120 million to crops, and around $40 million to school districts."
184,Approximately 150 bridges either became impassable or were swept away.
185,"Following Agnes, three news correspondents and the pilot died in a helicopter crash in Harrisburg on June 26, 1972, while reporting on the flooding."
186,"The victims were Del Vaughn of CBS News and Sid Brenner and Louis Clark of WCAU in Philadelphia, and the pilot, Mike Sedio."
187,"The helicopter lost its rotor some three hundred feet(90 m) above the Capital City Airport, crashed, and exploded on the runway."
188,"---Upstate New York---
Olean, Elmira, and Corning, as well as many other Southern Tier towns, were severely flooded."
189,Sections of the Erie Lackawanna Railroad main line between Hornell and Binghamton were severely damaged.
190,It is mainly regarded as the death of the Erie Lackawanna Railroad since the costs of damages were high and put the final dagger into the company.
191,"Flooding in the upper Allegheny River basin was particularly exacerbated by the construction of the Kinzua Dam less than a decade prior; several towns in Cattaraugus County suffered extensive road and bridge damage that, four decades later, had yet to be repaired, with the state and local governments opting to abandon creek and river crossings instead of reconstruct them."
192,"The dam succeeded in preventing further damage downstream in western Pennsylvania, and much of the flood-prone areas in the Allegheny Reservoir region had already been cleared of residents in preparation for the dam's construction."
193,"In Elmira, porches and garages were ripped loose, the Walnut St. bridge was carried away, Maple Ave."
194,"to Notre Dame High School was ""underwater"", and on S. Main St., Gerould's Pharmacy at W. Hudson was engulfed by 10 feet 3 inches(3.12 m) of water."
195,Hornell's damage was minimal largely due to the protection of two dam systems installed after the devastating 1935 flood.
196,Both the Arkport and Almond Dams saved Hornell from the level of damage found in neighboring communities.
197,Three US Army Corps of Engineers were killed in Hornell when their helicopter came in contact with power lines over Crosby Creek.
198,"The height of the floodwaters has been marked in the entrance to the Corning Museum of Glass, showing that much of the museum was under water to a height of about 1.6 metres(5.2 ft) above the floor, causing substantial damage to the collection and archives."
199,Parts of Corning were under more than 3 metres(9.8 ft) of flood waters.
200,"---West Virginia and Ohio---
Rainfall in West Virginia was generally light, though heavier in the Eastern and Northern Panhandles of the state."
201,Precipitation peaked at 7.94 inches(202 mm) in Berkeley Springs.
202,"108 houses were destroyed and 1,558 others suffered damage."
203,"Furthermore, 118 mobile homes were destroyed and 91 were significantly affected."
204,"10 farm buildings reported major losses, while 18 small businesses were either damaged or destroyed."
205,"In the state of West Virginia, no fatalities were reported and damage was slightly more than $7.7 million."
206,"Although no reports of abnormally high winds or rainfall exists in Ohio, the storm caused minor damage to about 302 dwellings and severely affected at least three houses."
207,"In addition, at least 100 mobile homes suffered major damage."
208,Northeasterly winds from the storm waves reaching a height of 15 feet(4.6 m) along the shore of Lake Erie and also caused the water level to rise by 3.5 feet(1.1 m).
209,"Houses, cars, boats, buildings, ships, and docks in the vicinity of Lake Erie were damaged."
210,"Overall, losses in Ohio totaled to at least $4 million."
