,sentences
0,"The 1945 Outer Banks hurricane was a moderate hurricane that struck Florida and affected the East Coast of the United States in late June, 1945."
1,"The first tropical storm and the first hurricane of the Atlantic season, it developed on June 20 in the western Caribbean Sea off Honduras."
2,"For the next two days, it moved generally northward into the Gulf of Mexico."
3,"Reaching hurricane intensity on June 23, it then turned northeast toward the Florida peninsula."
4,"It made landfall in the Big Bend on June 24, then weakened to a tropical storm over land."
5,"Minor damage was reported in Florida, but the storm produced heavy, though beneficial, rains that eased one of the state's worst recorded droughts."
6,"Upon entering the Atlantic Ocean, it re-intensified into a hurricane and paralleled the East Coast."
7,"On June 26, it struck the Outer Banks of North Carolina as a minimal hurricane, producing minor damage but heavy rainfall."
8,"Continuing northeast, the cyclone delivered gale-force winds to New York and southern New England, causing traffic accidents and minor wind damage."
9,"Heavy rains drenched the area, and high waves offshore caused ships to need rescue."
10,One man died in a traffic accident; some people were rescued on Long Island Sound.
11,"Peak winds on land were 66 miles per hour(106 km/h) at Nantucket, forcing ships to remain in port."
12,The U.S. Coast Guard sought to escort ships at sea into safe harbor.
13,"Overall, the impact of the storm was minor, though temperatures fell almost 20 °F(−7 °C) the day after the storm."
14,"-Meteorological history-
On June 19, a tropical disturbance was detected between Swan Island and the Honduran coast."
15,"However, surface data in the vicinity did not indicate a closed circulation until 12 UTC on June 20."
16,"At 14 UTC that day, an Air Force reconnaissance plane located near 24°N 84°W reported gale-force winds of 35 knots(18 m/s)(40 miles per hour(64 km/h))."
17,"At the time, this was taken to indicate that a tropical storm had formed about 100 miles(160 km) northwest of Swan Island."
18,"Reanalysis by the Hurricane Research Division in 2013, however, determined that a tropical storm formed farther northwest, near 19°N 86°W. Squally weather, and winds of moderate tropical storm force, was reported in connection with the tropical storm as it moved generally northward, toward the Yucatán Channel."
19,"Little strengthening occurred over the next two days, until after 12 UTC on June 22."
20,"At that time, a period of rapid deepening commenced: within 24 hours, the cyclone increased its winds from 50 mph(80 km/h) to 80 mph(130 km/h)."
21,"At the same time, its track made a sharp bend toward the northeast, threatening the Florida peninsula."
22,"While no central pressure was recorded, Hurricane Hunter aircraft flew into the storm on June 23 and reported winds of 115 mph(185 km/h) at 2015 UTC."
23,"As with most early reconnaissance data, such readings are suspect; however, based upon the reconnaissance measurement, the storm was originally listed in the Atlantic hurricane database as a Category 3 hurricane."
24,"Later, reanalysis lowered this estimate to 100 mph(160 km/h), equal to Category 2 on the modern Saffir-Simpson Hurricane Scale, due primarily to the absence of corroboration."
25,"After peaking late on June 23, the storm quickly lost intensity."
26,"The hurricane continued northeast and made landfall at 08 UTC on June 24, north of the Tampa Bay Area."
27,"Although observations were sparse near the eye, the system was estimated to have had winds of 80 mph(130 km/h), though only minor impacts were reported as few people lived in the landfall area."
28,"After making landfall, the center tracked inland between Brooksville and Dunnellon, near the Hernando–Citrus county line."
29,"About an hour before 18 UTC, the cyclone returned to water off the Atlantic coast of Florida, passing between St. Augustine and Daytona Beach."
30,"Due to interaction with land, maximum sustained winds by then had decreased to 60 mph(97 km/h)."
31,"After moving offshore, however, the cyclone quickly regained force."
32,"Within seven hours, it re-intensified into a minimal hurricane and paralleled the Southeastern United States, following the warm Gulf Stream."
33,"Early on June 26, the northeast-moving hurricane approached the North Carolina coast, and made a second landfall at 01 UTC near Beaufort, North Carolina."
34,"Passing very near to Cape Hatteras, the eye of the storm moved offshore at Oregon Inlet, near Wanchese."
35,The storm maintained hurricane intensity as it moved over and northeast of the Outer Banks.
36,"At 06 UTC on June 27, the cyclone finally lost tropical characteristics, but still retained winds of hurricane force for another 12 hours."
37,"Continuing to the northeast, the extratropical low passed south of Nova Scotia and hit Miquelon, Miquelon-Langlade, Saint Pierre and Miquelon, with winds of 40 mph(64 km/h)."
38,"The system survived another four days, only to lose its identity near Iceland at 12 UTC on July 4."
39,"-Preparations and impact-
As early as June 19, the U.S. Weather Bureau began sending reconnaissance missions to monitor the developing storm in the Caribbean."
40,The regular reports sent by the airplanes provided valuable data about the intensity of the small cyclone.
41,"At 16 UTC(10:00 a.m. local time) on June 23, the U.S. Weather Bureau in New Orleans advised residents from Mobile, Alabama, to Cedar Key, Florida, to prepare for gale-force winds."
42,"Areas from Tampa to Grand Isle, Louisiana, were placed under a storm warning."
43,"The center of the storm was expected to strike land early on June 24 between Mobile and Panama City, Florida."
44,"As the storm intensified into a hurricane, forecasters shifted their predicted landfall point eastward; early on June 24 the Weather Bureau expected the storm to strike between Tampa and Cross City, Florida."
45,"Hurricane warnings were issued for the coastline between Tampa and Carrabelle, Florida; meanwhile, storm warnings were issued from Punta Gorda to Titusville."
46,"The city of Tallahassee prepared to receive evacuees, and evacuations were ordered for coastal communities in the Big Bend."
47,"The Florida Highway Patrol warned local residents to leave the area, and soldiers were transported out of Carrabelle."
48,"As the hurricane moved closer to the Big Bend, storm warnings were extended up the Eastern Seaboard to Savannah, Georgia."
49,"Between 300 and 400 military aircraft were flown out of Florida to Birmingham, Alabama."
50,"Once the storm left Florida, additional evacuations commenced between Georgetown, South Carolina, and Cape Hatteras, including the North Carolina communities of Wilmington, Morehead City, and nearby resort towns."
51,"Large-scale evacuations from the Wilmington area alone involved 5,000 people and were credited with reducing loss of life."
52,"Meanwhile, storm warnings were extended northward to Norfolk, Virginia; however, only minor impacts occurred in Carolinas and Virginia."
53,"Nevertheless, the cyclone continued to parallel the East Coast, so storm warnings were eventually extended to Atlantic City, New Jersey; small watercraft in the Northeastern United States were advised to stay in port."
54,"Winds in the Tampa Bay Area reached tropical storm force, 39–46 mph(63–74 km/h), at 05 UTC on June 24."
55,"At that time, the ""center"" of the storm was estimated to be 25 mi(40 km) across."
56,"Near the point of landfall, the hurricane defoliated citrus trees and downed power lines, and flash floods washed out roadways."
57,"Throughout its path, the hurricane generated prolific rains."
58,Peak rainfall along the path totaled 13.6 in(350 mm) at Lake Alfred; West Palm Beach recorded 11.4 inches(290 mm) of rain within a 24-hour period.
59,"Rainfall in Orange County exceeded 6 in(152 mm), which proved beneficial to dry orange groves; the heavy rains ended one of the worst droughts in Florida's history."
60,"Overall, damage in the Miami area was described as being slight, totaling $75,000(1945 USD)."
61,"The hurricane also produced two tornadoes in Florida, one near LaBelle and another near Melbourne."
62,"Along the Georgia coast, the hurricane produced only fringe impacts, including strong winds and heavy rain."
63,"Wind gusts to 70 mph(110 km/h) were reported from Tybee Island, and portions of coastal North Carolina received up to 8.24 in(209 mm) of rain."
64,"In New York and New England, the outer bands of the hurricane produced gale-force winds and high surf;  peak winds were reported at up to 50 mph(80 km/h) on Long Island Sound, and large waves caused some boats to capsize and people to need rescue."
65,"Offshore, even higher velocities were reported: a weather station on Nantucket, Massachusetts, measured a peak wind of 66 mph(106 km/h), and in the Atlantic Ocean winds reaching 70 mph(110 km/h) battered Coast Guard vessels."
66,The Coast Guard nevertheless sought to escort troubled ships into port.
67,"Heavy rainfall fell across coastal New England, peaking at 4.59 in(120 mm) on Nantucket."
68,"The heavy rains and gale-force winds hindered normal traffic; a vehicle struck and killed a man at Warwick, Rhode Island."
69,"At least 10,000 telephone lines were taken out of service, 7,000 of them in the Cape Cod region."
70,"Besides causing power outages, the stormy conditions damaged trees, buildings, and crops; in the Boston area, high winds knocked down trees and chimneys."
71,"A strong temperature gradient existed between the cyclone and the Northeast U.S.: in New York City, the daily high on June 26 was almost 20° F lower than on the preceding day."
